{
  "generated_at": "2026-02-22T16:04:59.844016+00:00",
  "version": "network_friction_v1",
  "size_usd": 5000.0,
  "assumptions": {
    "dex_roundtrip_tx_legs": 2,
    "solana_compute_units_per_leg": 250000,
    "evm_gas_units_per_leg": 180000
  },
  "market_refs": {
    "SOLUSDT": 83.465,
    "ETHUSDT": 1953.105,
    "MATICUSDT": 0.9
  },
  "dex_fee_overrides": {
    "jupiter": {
      "router_fee_bps": 4.0,
      "network_fee_bps": 0.0016693,
      "total_fee_bps": 4.0016693,
      "network_model": "solana"
    }
  },
  "networks": {
    "solana": {
      "source": "live",
      "base_fee_lamports_per_tx": 5000,
      "priority_micro_lamports_per_cu_median": 0.0,
      "priority_micro_lamports_per_cu_p75": 0.0,
      "compute_units_per_leg": 250000,
      "dex_roundtrip_tx_legs": 2,
      "sol_usd": 83.465,
      "estimated_cost_usd_roundtrip": 0.00083465,
      "estimated_cost_bps_roundtrip": 0.0016693,
      "warnings": []
    },
    "polygon": {
      "source": "live",
      "max_fee_gwei": 272.0350903,
      "gas_units_per_leg": 180000,
      "dex_roundtrip_tx_legs": 2,
      "matic_usd": 0.9,
      "estimated_cost_usd_roundtrip": 0.08813937,
      "estimated_cost_bps_roundtrip": 0.17627874,
      "warnings": []
    },
    "ethereum": {
      "source": "live",
      "standard_gas_wei": 52075609.0,
      "standard_gas_gwei": 0.05207561,
      "gas_units_per_leg": 180000,
      "dex_roundtrip_tx_legs": 2,
      "eth_usd": 1953.105,
      "estimated_cost_usd_roundtrip": 0.03661529,
      "estimated_cost_bps_roundtrip": 0.07323058,
      "warnings": []
    }
  },
  "warnings": [
    "MATICUSDT_fallback_used"
  ]
}